category,subcategory,description,imageurl,
Activity,Camping,Explore the Great Outdoors with Confidence: Your Essential Camping Gear Starts Here!,https://d1pk12b7bb81je.cloudfront.net/thumbor/se3xprx7sT7HwSurgP1Efs_K6WA=/1920x910/https://d1pk12b7bb81je.cloudfront.net/images/photos/slideshows/1691508648_photo-4.jpg,
Activity,Outdoors,Embrace Adventure: Unleash Your Spirit for Outdoor Exploration!,https://travelnevada.com/wp-content/uploads/2024/01/OutdoorRec-HeroImage.jpg,
Activity,Biking,Pedal Your Way to Freedom: Explore the World on Two Wheels!,https://images2.giant-bicycles.com/b_white%2Cc_pad%2Ch_1000%2Cq_80%2Cw_1920/m48b97ivhrze19ebrxyv/Banner_RidingWithKids.jpg,
Activity,Swimming,Dive Into Excellence: Embrace the Waters with Confidence!,https://www.winonaymca.org/sites/default/files/2023-01/group_swim_lessons_hero_banner_1800x900.jpg,
Activity,Fitness,Elevate Your Fitness Journey: Reach New Heights with Every Step!,https://f45training.com/wp-content/uploads/2023/07/slide2-poster-min.jpg,
Activity,Beach,"Embrace the Sun, Sand, and Sea with Our Beach Essentials!",https://assets-global.website-files.com/5e86c7170f1ab21474c3f2a4/61a9d1a4a3e19b524e20731f_Sand-styling-hacks-cover-photo.jpg,
Automotive,Car,Drive with Confidence: Explore Our Range of Quality Car Essentials!,https://d1u9153gczvvuy.cloudfront.net/wp-content/uploads/2022/07/M1_car-soaps_thumbnail.jpg,
Automotive,Truck,Elevate Your Trucking Experience: Discover Top-Quality Truck Essentials!,https://assets.volvo.com/is/image/VolvoInformationTechnologyAB/super-truck?wid=1400&fit=constrain,
Automotive,Engine,Rev Up Your Ride: Explore High-Performance Engine Essentials!,https://carorbis.com/wp-content/uploads/2023/04/Featured-image-1.jpg,
Automotive,Tyres,Roll with Confidence: Discover Durable and Reliable Tires!,https://d1u9153gczvvuy.cloudfront.net/wp-content/uploads/2022/07/M1_tireshine_thumbnail.jpg,
Beauty,Bath,Elevate Your Bath Experience: Luxurious Essentials for Every Moment,https://cdn.goturkiye.com/goturkey/1920x600-turkish-bath-products-to-try-at-least-once.jpg,
Beauty,Hair Care,"Nourish Your Locks, Embrace Your Style: Transformative Haircare Solutions",https://cdn.store-assets.com/s/1272135/f/10862875.jpg,
Beauty,Makeup,"Enhance Your Beauty, Express Yourself: Radiant Makeup Essentials",https://media.cnn.com/api/v1/images/stellar/prod/220901191124-fall-makeup-trends-danessa-lead.jpg?c=original,
Beauty,Skin Care,Unlock Your Natural Glow: Nourishing Skincare Solutions,https://www.lorealparisusa.com/-/media/project/loreal/brand-sites/oap/americas/us/beauty-magazine/2023/08-august/8-30/the-best-skincare-routine-for-your-30s/best-skin-care-routine-for-your-30s.jpg?rev=ddaac086eb1a45958d264cad92b70528,
Beauty,Personal,Elevate Your Everyday: Personal Care Essentials for You,"https://res.cloudinary.com/g5-assets-cld/image/upload/x_17,y_1393,h_1533,w_5110,c_crop/q_auto,f_auto,fl_lossy,g_center,h_600,w_2000/g5/g5-c-iqbdd9s4-merrill-gardens-client/g5-cl-1lb6ft2530-merrill-gardens-client-doylestown-pa/uploads/MercerHill-PersonalCare-HERO_fqnaa1.jpg",
Clothing,Womens,Embrace Your Style: Fashion That Empowers Women,https://promova.com/content/female_clothes_013b4bec9c.png,
Clothing,Kids,Playful Threads for Adventurous Kids,https://www.parents.com/thmb/EyWg3P81DkloXNuAH-xX-ZhdpfM=/1500x0/filters:no_upscale():max_bytes(150000):strip_icc()/update-parents-best-kids-clothing-stores-online-tout-f8ad523ce57c4bf2a607a0d56617cd8e.jpg,
Clothing,Baby,Soft Comforts for Your Little Bundle,https://promova.com/content/baby_clothes_names_22638ca5c6.png,
Clothing,Mens,Elevate Your Style with Every Step,https://kannonsclothing.com/cdn/shop/files/kannon_s-men_s.jpg?v=1683409366&width=1500,
Clothing,Jewelry,Unleash Your Inner Sparkle,https://static.vecteezy.com/system/resources/previews/026/107/980/non_2x/hand-drawn-clothing-shoes-and-accessories-big-set-female-apparel-dresses-underwear-shoes-coats-sweaters-hats-in-casual-style-flat-graphic-illustrations-isolated-on-white-background-vector.jpg,
Electronics,Technology,"Elevating Tomorrow, Today",https://imageio.forbes.com/specials-images/imageserve/6200b0dddcf32d3be937fa84/0x0.jpg?format=jpg&height=900&width=1600&fit=bounds,
Electronics,Phone,"Stay Connected, Stay Empowered",https://www.digitaltrends.com/wp-content/uploads/2020/01/tcl-10-phones.jpeg?fit=1500%2C1000&p=1,
Electronics,Computer,"Empowering Innovation, Simplifying Life",https://www.digitaltrends.com/wp-content/uploads/2023/05/lenovo-yoga-book-9i-front-angled-e1684955192357.jpg?fit=1500%2C1000&p=1,
Electronics,Camera,"Capture Every Moment, Embrace Every Memory",https://blenderartists.org/uploads/default/original/4X/9/e/7/9e770a642d2ef1a84345e5bc39b0d5a775acfe27.jpg,
Entertainment,Book,"Unlock Your Imagination, One Page at a Time",https://i0.wp.com/dailynutmeg.com/wp-content/uploads/2022/10/shutterstock_569895262_1500bi.jpg?fit=1500%2C1000&ssl=1,
Entertainment,Music,Let the Rhythm Move You,https://moveconcerts.com/wp-content/uploads/2021/09/Copy-of-ED_SHEERAN_xGALLOBLUGUERMANN-4-1500x1000-1.jpg,
Entertainment,Game,Unlock Endless Adventures,https://www.themarbleous.com/wp-content/uploads/2020/09/TTT-white_2-1500-x-1000.jpg,
Entertainment,Party,Let the Good Times Roll!,https://www.sweetwater.com/insync/media/2023/02/Mackie-JBL-and-QSC-PA-Speakers.jpg,
Entertainment,Movie,Get Ready for a Cinematic Adventure!,https://www.lifewire.com/thmb/UpaxO2fc_mSO9DF1igfI4yOia5U=/1500x0/filters:no_upscale():max_bytes(150000):strip_icc()/GettyImages-755656907-5c156ce5c9e77c0001b35c4f.jpg,
Entertainment,Toy,Unleash Your Imagination with Endless Fun!,https://imgproxy.urbaneez.art/insecure/rs:fit:1500:0/plain/https://imgproxy.urbaneez.art/insecure/rs:fit:1500:0/plain/https://urbaneez.fra1.digitaloceanspaces.com/assets/website/collections/street-toys-cover.jpg,
Health,Vitamin,Fuel Your Health with Nature's Best!,https://www.verywellhealth.com/thmb/vcHGlWCH8jbRLCU7BrFZ0DYLiY4=/1500x0/filters:no_upscale():max_bytes(150000):strip_icc()/vwh-best-vitamin-d-supplements-tout-8688559dcf0c4b089f406ff82ef70de2.jpg,
Health,First Aid,"Empowering Safety, Healing Every Step of the Way!",https://atr-ltd.co.uk/wp-content/uploads/2020/09/first-aid-training-course-instructor.jpg,
Health,Medicine,Your Trusted Partner in Health and Wellness.,https://www.brookings.edu/wp-content/uploads/2020/06/global_belgium_medicine_blister_packs.jpg?quality=75&w=1500,
Health,Nutrition,Elevate Your Health with Our Premium Nutrition Solutions.,https://www.verywellfit.com/thmb/zkU5Eji9ciXJUtKIdkTyqsyLOKw=/1500x0/filters:no_upscale():max_bytes(150000):strip_icc()/Plant-baseddietjenifoto-73193eabbdc9402ab3bc535562e2ed7e.jpg,
Home,Storage,"Stay Organized, Simplify Your Life with Our Innovative Storage Solutions.",https://i0.wp.com/bhamnow.com/wp-content/uploads/2023/02/Waypoint-Investments-20-scaled.jpg?resize=1500%2C1000&quality=89&ssl=1,
Home,Bedding,Transform Your Sleep Experience with Luxurious Bedding Essentials.,https://cdn.walletmonitor.com/img/26d729391d600f4311f370baa700f648.jpg,
Home,Kitchen,Elevate Your Culinary Creations with Our Kitchen Essentials.,https://dynamicgroupplus.com/wp-content/uploads/dynamicgroup_kitchen_1500_1000-73-1.jpg,
Home,Gardening,Cultivate Your Green Oasis with Our Gardening Essentials.,https://www.insidehook.com/wp-content/uploads/2023/04/springgardenprep_1500x1000.jpg?fit=1500%2C1000,
Home,Furniture,Elevate Your Space with Stylish Furniture Solutions.,https://freight.cargo.site/t/original/i/3dbb1e62e13c91e6ed1629f40ccd8fb3d842149397248924e0edbce689c5e8b5/TEE-Rectangle---Round-Oak---Image-1-1500-x-1000.jpg,
Home,Dining,Create Memorable Dining Experiences with Our Quality Products.,https://i0.wp.com/www.homebeautiful.com.au/wp-content/uploads/sites/2/umb-media/14508/100118-mismatched-dining-chairs-5.jpg?fit=1500%2C1000&ssl=1,
Home,Cooking,Unleash Your Culinary Creativity with Our Top-Quality Cooking Essentials.,https://www.themanual.com/wp-content/uploads/sites/9/2020/10/kitchen-essential-tools-2020.jpg?fit=1500%2C1000&p=1,
Home,Cleaning,Elevate Your Cleaning Experience with Our Effective and Eco-Friendly Solutions.,https://www.insidehook.com/wp-content/uploads/2023/07/cleaning-products.jpg?fit=1500%2C1000,
Home,Home Improvement,"Transform Your Space, One Project at a Time, with Our Quality Home Improvement Products.",https://images.squarespace-cdn.com/content/v1/588bba293a041194fc7bf556/2306fe28-5fb7-44e7-bbc0-bfe4787a411a/BLOG+POST+DESIGN+%281000+%C3%97+1500+px%29+%281000+%C3%97+1500+px%29+%281500+%C3%97+1000+px%29+%281000+x+1500+px%29-4.png,
Pets,Aquarium,Reel in Quality and Freshness with Our Finest Fish Products!,https://i0.wp.com/aquascapes.com/wp-content/uploads/2018/06/Ecosystem-Pond_14.jpg?fit=1500%2C1000&ssl=1,
Pets,Dog,Paws-itively Perfect Products for Your Furry Friend!,https://i0.wp.com/platopettreats.com/wp-content/uploads/2021/07/Keep-Em-Busy-Chicken-w-toys.jpg?fit=1500%2C1000&ssl=1,
Pets,Cat,Feline-Friendly Finds for Your Purr-fect Pal!,https://i0.wp.com/katzenworld.co.uk/wp-content/uploads/2017/03/foxy-and-heart2.jpg?fit=1500%2C1000&ssl=1,